{
  "schemaVersion": "1.0.0",
  "id": "knowledge",
  "contentVersion": 1,
  "status": "draft",
  "defaultLocale": "ja-JP",
  "name": {
    "ja-JP": "知識領域"
  },
  "description": {
    "ja-JP": "書物、記録、目録、翻訳、注釈、地図、記憶を通して、知ることと解釈することの力と危うさを扱う領域。"
  },
  "tags": [
    "archive",
    "books",
    "interpretation",
    "memory",
    "records"
  ],
  "localizedContent": {
    "ja-JP": {
      "scope": "知識の獲得だけでなく、分類、継承、忘却、誤読、公開、更新までを一つの循環として扱う。",
      "centralQuestion": "いま必要なのは、さらに知ることか、すでに知っていることを選び直して行動することか。",
      "motifs": [
        "書庫と目録",
        "写本と注釈",
        "地図と星図",
        "講堂と工房",
        "記録の改訂と公開"
      ],
      "interpretationGuidance": {
        "tone": "知的で幻想的だが、相談者を情報収集だけへ逃がさず、観察可能な次の行動へ戻す。",
        "priorities": [
          "事実・解釈・願望を分ける",
          "知識が誰にどう継承されるかを見る",
          "不確実性を残したまま選べる小さな行動を示す"
        ],
        "cautions": [
          "知識量を優越性と同一視しない",
          "引用や権威を本人の判断の代用品にしない"
        ]
      },
      "generationGuidance": {
        "include": [
          "知識を扱う具体的な人物・場所・物・出来事",
          "恩恵と代償が同居する中心的矛盾",
          "原型の中心的意味を知識世界の象徴へ変換した表現"
        ],
        "avoid": [
          "既存作品の固有設定や文章の模倣",
          "万能の正解を断言する設定",
          "単なる本や図書館の外観説明だけで終わるカード"
        ]
      },
      "visualDirection": {
        "motifs": [
          "果ての見えない書架",
          "発光する文字と索引",
          "真鍮の計器と紙の建築",
          "人の尺度を超えた記録装置"
        ],
        "palette": [
          "羊皮紙色",
          "深い藍",
          "酸化した金",
          "墨色",
          "星明かりの白"
        ],
        "avoid": [
          "現代的な企業ロゴ",
          "読める長文の描き込み",
          "実在作品の装丁や意匠の再現"
        ]
      }
    }
  },
  "publication": {
    "publishedAt": null,
    "retiredAt": null
  }
}

