{
  "schemaVersion": "1.0.0",
  "id": "celestial",
  "contentVersion": 1,
  "status": "draft",
  "defaultLocale": "ja-JP",
  "name": {
    "ja-JP": "天体領域"
  },
  "description": {
    "ja-JP": "恒星、惑星、彗星、星雲、軌道、光と影を通して、始まり、関係、変化、終結、再出発を考える領域。天体は内省の象徴として扱う。"
  },
  "tags": [
    "celestial",
    "stars",
    "orbits",
    "light",
    "cycles"
  ],
  "localizedContent": {
    "ja-JP": {
      "scope": "天体の誕生と移ろい、距離と引力、観測の限界を、選択や関係を見直すための架空の物語へ変換する。",
      "centralQuestion": "いま自分で動かせるものは何か。そして、自分では決められない流れとどう付き合うか。",
      "motifs": [
        "彗星と旅路",
        "連星と互いの距離",
        "星雲と育成",
        "軌道と循環",
        "暗月と見えないもの",
        "星の終わりと銀河の環"
      ],
      "interpretationGuidance": {
        "tone": "広い宇宙の静けさと畏敬を保ち、日常で確かめられる小さな行動へ結び付ける。",
        "priorities": [
          "変えられる条件と変えられない条件を分ける",
          "近さだけでなく境界と距離を考える",
          "原型の意味を、具体的な選択と振り返りへつなぐ"
        ],
        "cautions": [
          "天体の配置が人生の結果を決めるとは述べない",
          "架空の象徴を科学的事実や災厄の予告として扱わない"
        ]
      },
      "generationGuidance": {
        "include": [
          "原型ごとに異なる天体の象徴",
          "恩恵と代償が同居する中心的矛盾",
          "正位置と逆位置で異なる状態と実行可能な助言"
        ],
        "avoid": [
          "未来や成功の確約",
          "実在人物や既存作品に依存した設定",
          "星の外見だけで意味の違いがないカード"
        ]
      },
      "visualDirection": {
        "motifs": [
          "金と紺の共通フレーム",
          "光る軌道と真鍮の天文器具",
          "深い星空と彩りのある星雲",
          "人と天体の大きさの対比"
        ],
        "palette": [
          "深い紺",
          "古金色",
          "月白",
          "青緑",
          "琥珀",
          "星雲の薔薇色"
        ],
        "avoid": [
          "現代の企業ロゴ",
          "読める長文や無関係な文字",
          "実在作品の構図の再現"
        ]
      }
    }
  },
  "publication": {
    "publishedAt": null,
    "retiredAt": null
  }
}
